واتە د ژیوار دا مرۆفێ رۆژهەلاتا ناڤین کەفتیە ل ژێر دۆخەکێ پر کارەسات پربازارکری دا	واتە د ژیوار دا مرۆڤێ رۆژهەلاتا ناڤین کەفتیە ل ژێر دۆخەکێ پر کارەسات پر بازارکری دا	SPC-MRG,SCR-DIA
دەربارەیڤێ گۆتنێ رەوشت ئێک بۆچوونێ ژ ئەوێن ل سەری ب پێدڤی نزانیت، واتە بۆچی	دەربارەی ڤێ گۆتنێ رەوشت ئێک بۆچوونێ ژ ئەوێن ل سەری ب پێدڤی نزانیت، واتە بۆچی	SPC-MRG
سەرەکی جیهان رۆسیا داوخاز ل تورکیا کریە ئێرشی رۆژئاڤایێ کوردستانێ نەکەت	سەرەکی جیهان رۆسیا داخواز ژ تورکیا کریە ئێرشی رۆژئاڤایێ کوردستانێ نەکەت	TYP-TRA,GRM-FNW
پەیڤدارێ وەزارەتا چاندنێ ئاشکرا کر، وەزارەت پشتەڤانیا وان جۆتیاران دکەت یێن بخوازن بەرهەمێ خوە ببنە دەڤەرێن ناڤەڕاست و باشوورێئیراقێ، نوکە دشێت ببەت و دبێژیت: هەر بەرهەمەکێ نڤیسار د گەل دا بیت رێگری لێ ناهێتە کرن	پەیڤدارێ وەزارەتا چاندنێ ئاشکرا کر، وەزارەت پشتەڤانیا وان جۆتیاران دکەت یێن بخوازن بەرهەمێ خوە ببنە دەڤەرێن ناڤەڕاست و باشوورێ ئیراقێ، نوکە دشێت ببەت و دبێژیت: هەر بەرهەمەکێ نڤیسار د گەل دا بیت رێگری لێ ناهێتە کرن	SPC-MRG
د کۆمبوونێدا هەر دو ئالیان دوپاتی ل گرنگریا ئێک هەلوەستی ل سەر ئاستێ نشتیمانی کریە و ئێکرێزی و هەماهەنگی بۆ بەرهنگاربوونا گوهۆڕبنان د وارێ ئابۆری و ژیان و خزمەتگۆزاریێن پێدڤی دا ب مەرەما دابینکرنا ژیانەکا باشتر بۆ هەمی وەلاتیێن ئیراقێ ب پێدڤی زانی	د کۆمبوونێ دا هەر دو ئالیان دوپاتی ل گرنگریا ئێک هەلوەستی ل سەر ئاستێ نشتیمانی کریە و ئێکرێزی و هەماهەنگی بۆ بەرهنگاربوونا گوهۆڕینان د وارێ ئابۆری و ژیان و خزمەتگۆزاریێن پێدڤی دا ب مەرەما دابینکرنا ژیانەکا باشتر بۆ هەمی وەلاتیێن ئیراقێ ب پێدڤی زانی	TYP-SUB,SPC-CLT
وهک نیمەكێ کوردینییێ یێ ئێکگرتی مە کارێ خوە یێ رەوشەنبیری ب رەنگەکێ خورت ئەنجام ددا	وەک تیمەکێ کوردینییێ یێ ئێکگرتی مە کارێ خوە یێ رەوشەنبیری ب رەنگەکێ خورت ئەنجام ددا	SCR-KAF,TYP-SUB,SCR-HEH
36 دۆلارێن ئەمریکی و هەروەسا بهایێ پەترۆلا تێکساس ژی ب رێژەیا 2ێ بلند بوویە و هەر بەرمیلەک ب 80	36 دۆلارێن ئەمریکی و هەروەسا بهایێ پەترۆلا تێکساس ژی ب رێژەیا 2%ێ بلند بوویە و هەر بەرمیلەک ب 80	TYP-DEL
توهمەت بەستن ئاسانە و هەر رۆژ ب ئاوایەکێ بۆ هێزێن باشور هەمی رەنگێ توهمەتا درست دکەن کو پتر خزمەتا داگيرکەران دکەن	توهمەت بەستن ئاسانە و هەر رۆژ ب ئاوایەکێ بۆ هێزێن باشور هەمی رەنگێ توهمەتا درست دکەن کو پتر خزمەتا داگیرکەران دکەن	SCR-YEH
هەمەدەنگ 05/12/2022 13:46 2	هەمەرەنگ 05/12/2022 13:46 2	TYP-SUB
رێکخر اوا نوشدارێن بەزاندنا کیشوەرا دێ خزمەتا ئاوارا کەت	رێکخراوا نوشدارێن بەزاندنا کیشوەرا دێ خزمەتا ئاوارا کەت	SPC-SPL
سەرهکی/نوچە/سەرۆک بافڵ :بەزاندنا هێلێن سۆر ئەنجامێن وێ دباش نابن	سەرەکی/نوچە/سەرۆک بافڵ : بەزاندنا هێلێن سۆر ئەنجامێن وێ دباش نابن	SCR-HEH,SPC-MRG
زارۆ دمینیتە دناڤبەرا دایکێ و بابی دا	زارۆک دمینیتە دناڤبەرا دایکێ و بابی دا	TYP-DEL
رێڤەبەرێ گشتیێ چاندن ل پارێزگەها دهۆکێ راگەهاند، حۆکمەتا عیراقێ سەرەدەریێ ل گەل مە دکەت وەک وەلاتەکێ جیران و گەلەک گرفتا بۆ مە دروست دکەت، دیار کر ژی کو رێژا گەنمی ل ئەف سالە ب رێژا 100% زێدەبویە	رێڤەبەرێ گشتیێ چاندنێ ل پارێزگەها دهۆکێ راگەهاند، حۆکمەتا عیراقێ سەرەدەریێ ل گەل مە دکەت وەک وەلاتەکێ جیران و گەلەک گرفتا بۆ مە دروست دکەت، دیار کر ژی کو رێژا گەنمی ل ئەڤ سالە ب رێژا 100% زێدەبوویە	TYP-DEL,SCR-DIA,TYP-DBL
عەبدولکەریم چەمانکی، سەرۆکێ لژنا باژێرڤانی و خزمەتگۆزاریێن گشتی و گەشتوگۆزار ل جڤاتا پارێزگەها دهۆکێ راگەهاند کو هێشتا کێشا کێمیا ئاڤێ نەهاتیە چارەکرن و هەردەمەکێ سەرهلدەتەڤە دێ سەرهلدەت و کار بۆ بنبڕکرنا وێ نەهلتیە کرن و گۆت: “ئەم بەردەوام یێ دووڤچوونا وێ کێشێ دکەین دا کو ب تەمامی بهێتە بنبڕکرن	عەبدولکەریم چەمانکی، سەرۆکێ لژنا باژێرڤانی و خزمەتگۆزاریێن گشتی و گەشتوگۆزار ل جڤاتا پارێزگەها دهۆکێ راگەهاند کو هێشتا کێشا کێمیا ئاڤێ نەهاتیە چارەکرن و هەردەمەکێ سەرهلدەتەڤە دێ سەرهلدەت و کار بۆ بنبڕکرنا وێ نەهاتیە کرن و گۆت: “ئەم بەردەوام یێ دووڤچوونا وێ کێشێ دکەین دا کو ب تەمامی بهێتە بنبڕکرن	TYP-SUB
قوباد تاڵەبانی گوت ژی،” د ئەڤرۆدا تۆشی چەندین قەیرانان بووینە ودا ژ خۆ بپرسن ئەگەر مام جەلال ل ڤێری بایە دا چ بێژیت، بو ژناڤبرنا هەمی ئالوزیان دشێین نوکتەیەکا مام جەلال بینینە هزرا خۆ و ئاریشەیێن خۆ پێ چارەسەر بکەین، بو بەرسڤدانا هەر پرسیارەکا مە هەیی، دشێین د گوتار و نڤیسینێن مام جەلالدا ببینین	قوباد تاڵەبانی گوت ژی،” د ئەڤرۆدا تۆشی چەندین قەیرانان بووینە و دا ژ خۆ بپرسن ئەگەر مام جەلال ل ڤێری بایە دا چ بێژیت، بو ژناڤبرنا هەمی ئالوزیان دشێین نوکتەیەکا مام جەلال بینینە هزرا خۆ و ئاریشەیێن خۆ پێ چارەسەر بکەین، بو بەرسڤدانا هەر پرسیارەکا مە هەیی، دشێین د گوتار و نڤیسینێن مام جەلالدا ببینین	SPC-CLT
نموونە/ گلۆ چاوا نەتەوی ل ئەورۆپا سەرگرت	نموونە/ گەلۆ چاوا نەتەوێ ل ئەورۆپا سەرگرت	SCR-DIA,TYP-DEL
سەقاناسی: ئەڤرۆ و سوباهیژی تۆزبارین دێ هەبیت – دەزگەهێ میدیایێ بادینان	سەقاناسی: ئەڤرۆ و سوباهی ژی تۆزبارین دێ هەبیت – دەزگەهێ میدیایێ بادینان	SPC-CLT
دامەزراندن، ب تایبەت یا تەخا گەنجان و دەرچویێن زانکۆ و پەیمانگەهان	دامەزراندن، ب تایبەت یا تەخا گەنجان و دەرچۆیێن زانکۆ و پەیمانگەهان	SCR-DIA
بەرنامێ شیرەتێن ساخلەمنێ، ئامادەکرن مەتین محەمەد، کامیرە رێبەر بامەرنی و ئەلند سەبیح، مونتاژ شێروان حەسەن	بەرنامێ شیرەتێن ساخلەمیێ، ئامادەکرن مەتین محەمەد، کامیرە رێبەر بامەرنی و ئەلند سەبیح، مونتاژ شێروان حەسەن	TYP-SUB
بۆ من کرنە هەبو ون و نەبو ون	بۆ من کرنە هەبوون و نەبوون	SPC-SPL,SPC-SPL
کوێستان محەمەد، وەزیرا کار و کاروبارێن جڤاکی د گۆتارەکێدا راگەهاند: خودان پێدڤیێن تایبەت پێدڤی ب رێزگرتنێنە نەکو دلپێفەمانێ و حکومەتا هەرێما کوردستانێ کار ل سەر بجهئینانا هەموو ماددەیێن یاسایا ژمارە 22 یا سالا 2011ێ دکەت	کوێستان محەمەد، وەزیرا کار و کاروبارێن جڤاکی د گۆتارەکێ دا راگەهاند: خودان پێدڤیێن تایبەت پێدڤی ب رێزگرتنێنە نەکو دلپێڤەمانێ و حکومەتا هەرێما کوردستانێ کار ل سەر بجهئینانا هەموو ماددەیێن یاسایا ژمارە 22 یا سالا 2011ێ دکەت	SPC-MRG,SCR-DIA
یێ ل سەر مێزا قوم ارێ	یێ ل سەر مێزا قومارێ	SPC-SPL
رۆژا 24ی تەباخا 1986ێ، بو بەرسڤا برووسکەیا سەرۆک ئەرکانێ تورکیا مە ئەڤ برووسکە هنارت:	رۆژا 24ی تەباخا 1986ێ، بۆ بەرسڤا برووسکەیا سەرۆک ئەرکانێ تورکیا مە ئەڤ برووسکە هنارت:	SCR-DIA
قەیرانا سیاسی خەلک بێزارکریە ویا ئابووری برسی کریە	قەیرانا سیاسی خەلک بێزارکریە و یا ئابووری برسی کریە	SPC-MRG
د هەڤدیتنەکێدا هەڤپەی ڤین ل دور بزاڤێن حکومەتێ هاتنە کرن و تەکەزی ل سەر پێنگاڤێن سەرئێخستنا پرۆسا چاکسازیێ هاتنە کرن و پشتەڤانیا لایەنان بۆ بجهئینانا کارناما حکومەتێ هاتە کرن	د هەڤدیتنەکێ دا هەڤپەیڤین ل دور بزاڤێن حکومەتێ هاتنە کرن و تەکەزی ل سەر پێنگاڤێن سەرئێخستنا پرۆسا چاکسازیێ هاتنە کرن و پشتەڤانیا لایەنان بۆ بجهئینانا کارناما حکومەتێ هاتە کرن	SPC-CLT,SPC-SPL
هەر پرتک بەر ب	هەر پرتەک بەر ب	TYP-DEL
چەند دنمەنەک ژ سولاڤا ئامێدیێ	چەند دیمەنەک ژ سولاڤا ئامێدیێ	TYP-SUB
د وان رۆژان دا وەزیرێ راگەهاندنا ئەسیۆپیا (حەبەشە)، د داخویانییەکێ دا هێرشەکا مەزن کرە سەر ئیراقێ ل دۆر کێشەیا کوردی، كو چاوا گەلێ کورد دهێتە ژ ناڤبرن و جۆتیارێن عەرەبل جهێن وان دهێنە ئاکنجیکرن، کو چ بەحسی مافێ مرۆڤی ژی دکەن	د وان رۆژان دا وەزیرێ راگەهاندنا ئەسیۆپیا (حەبەشە)، د داخویانییەکێ دا هێرشەکا مەزن کرە سەر ئیراقێ ل دۆر کێشەیا کوردی، کو چاوا گەلێ کورد دهێتە ژ ناڤبرن و جۆتیارێن عەرەب ل جهێن وان دهێنە ئاکنجیکرن، کو چ بەحسی مافێ مرۆڤی ژی دکەن	SCR-KAF,SPC-MRG
ناڤ خۆ 26/09/2014 09:1971	ناڤخۆ 26/09/2014 09:19 71	SPC-MRG,SPC-SPL
هێزێن سووریا دیمۆکرات هەسەد ژبەر هێرشێن تورکیا ئۆپەراسیۆنێن خۆ ل دژی رێکخستنا تیرۆرستیا داعشێ ل رۆژئاڤا راگرتن	هێزێن سووریا دیمۆکرات هەسەدێ ژبەر هێرشێن تورکیا ئۆپەراسیۆنێن خۆ ل دژی رێکخستنا تیرۆرستیا داعشێ ل رۆژئاڤا راگرتن	TYP-DEL
عسمەت محەمەد خالد رێژا دهۆکێ بوو (17%)، لدۆر چارەکرنا بابەتی سەرۆکا لیژنا پەروەردێ گۆت: دێ سەرەدانا رێڤەبەریا گشتی یا پەروەردا پارێزگەهێ ەین، پەرلەمان، جڤاتا وەزیران، دیسان وەزارەتا پەروەردێ و دێ دەنگێ خوە یێ نەرازیبوونێ گەهینێ	عسمەت محەمەد خالد رێژا دهۆکێ بوو (17%)، لدۆر چارەکرنا بابەتی سەرۆکا لیژنا پەروەردێ گۆت: دێ سەرەدانا رێڤەبەریا گشتی یا پەروەردا پارێزگەهێ کەین، پەرلەمان، جڤاتا وەزیران، دیسان وەزارەتا پەروەردێ و دێ دەنگێ خوە یێ نەرازیبوونێ گەهینێ	TYP-DEL
بلندبوونا بوهایێ دولاری ژ بەر بلندكرنا بوهایێن قازانجێ ل ئەمریکا ب ئەگەرەکێ سەرەکی یێ داکەفتنا نوی یا لیرەیێ بەرانبەر دولاری دهێتە هژمارتن	بلندبوونا بوهایێ دولاری ژ بەر بلندکرنا بوهایێن قازانجێ ل ئەمریکا ب ئەگەرەکێ سەرەکی یێ داکەفتنا نوی یا لیرەیێ بەرانبەر دولاری دهێتە هژمارتن	SCR-KAF
هەڤپشکێن ڤێ خەما مەزن کەس و کارێن قوربانییانین و دلێ مە ل گەل خەلکێ خۆشتڤیێ دهوکا عەزیزە	هەڤپشکێن ڤێ خەما مەزنا کەس و کارێن قوربانییانین و دلێ مە ل گەل خەلکێ خۆشتڤیێ دهوکا عەزیزە	TYP-TRA,TYP-DEL
قوباد تاڵەبانی سەرپەرشتیارێ مەکتەبا سکرتاریەتا سەرۆک مام جەلال سەرەدانا ئێکەتیا ژنێن کوردستانێ کر و ئامادەیی نیشان دا بۆ هەمی پشتەڤانییەکی ژپێخەمەت بەرەڤ پێشچوونا کارێن وان	قوباد تاڵەبانی سەرپەرشتیارێ مەکتەبا سکرتاریەتا سەرۆک مام جەلال سەرەدانا ئێکەتیا ژنێن کوردستانێ کر و ئامادەیی نیشاندا بۆ هەمی پشتەڤانییەکی ژپێخەمەت بەرەڤ پێشچوونا کارێن وان	SPC-CLT
سەرەکی فەیسبۆک ئاوارە د 455 قوتابخانەیێن دهۆکێ داەن و کەمپ ب لەز ناهێنە چێکرن	سەرەکی فەیسبۆک ئاوارە د 455 قوتابخانەیێن دهۆکێ دانە و کەمپ ب لەز ناهێنە چێکرن	TYP-TRA
رێکخستنا لێبۆرینا نێڤدەولەتی راگەهاند کو چەند رۆژن هێزێن ئێمناهیێ یێن ئیرانێ ل باژێرێ سنە یێ رۆژهەلاتێ کوردستانێ دەست ب کوشتنا وەلاتیێن سڤیل کرینە و هەتا نها گەلەک کەس هاتینە کوشتن، سنە ب تەمامی ژ ئالیێ هێزێن سەربازی ڤە هاتیە دۆرپێچ کرن و دڤێت وەلاتێن جیهانێ ل همەبەر رەوشا نها بێدەنگ نەمینن	رێکخستنا لێبۆرینا نێڤدەولەتی راگەهاند کو چەند رۆژن هێزێن ئێمناهیێ یێن ئیرانێ ل باژێرێ سنە یێ رۆژهەلاتێ کوردستانێ دەست ب کوشتنا وەلاتیێن سڤیل کرینە و هەتا نها گەلەک کەس هاتینە کوشتن، سنە ب تەمامی ژ ئالیێ هێزێن سەربازی ڤە هاتیە دۆرپێچ کرن و دڤێت وەلاتێن جیهانێ ل هەمبەر رەوشا نها بێدەنگ نەمینن	TYP-TRA
هەروەسا میدیایێن عیراقی ناڤێ 19 کەسا بەلاڤکر یە کو کاندیدن بۆ وەرگرتنا 19 وەزارەتا ل حکومەتا محەمەد شیاع سودانی، ب جۆرەکێ کو لەیس شاهر بۆ وەزارەتا نەفت و سالح حەسناوی بۆ وەزارەتا ساخلەمیێ و عەبدولئەمیر شەمەری بۆ وەزارەتا ناڤخۆ و تەیف سامی بۆ وەزارەتا دارایی کاندیدکرینە	هەروەسا میدیایێن عیراقی ناڤێ 19 کەسا بەلاڤکریە کو کاندیدن بۆ وەرگرتنا 19 وەزارەتا ل حکومەتا محەمەد شیاع سودانی، ب جۆرەکێ کو لەیس شاهر بۆ وەزارەتا نەفت و سالح حەسناوی بۆ وەزارەتا ساخلەمیێ و عەبدولئەمیر شەمەری بۆ وەزارەتا ناڤخۆ و تەیف سامی بۆ وەزارەتا دارایی کاندیدکرینە	SPC-CLT
پەرلەمانێ ئورۆپا د روونشتا خوە یا تایبەت دا ل سەر رەوشا سووریێ و عیراقێ راوەستیا و پدانیان کۆمێن د ناڤ پەرلەمانێ دا داخواز کرن کو بلا ئێکەتیا ئورۆپا ب هەموو رەنگان هاریکاریا سەربازی، سیاسی و ئابووری بدەتە کوردێن باشور و رۆژئاڤا	پەرلەمانێ ئورۆپا د روونشتنا خوە یا تایبەت دا ل سەر رەوشا سووریێ و عیراقێ راوەستیا و پرانیان کۆمێن د ناڤ پەرلەمانێ دا داخواز کرن کو بلا ئێکەتیا ئورۆپا ب هەموو رەنگان هاریکاریا سەربازی، سیاسی و ئابووری بدەتە کوردێن باشور و رۆژئاڤا	TYP-SUB,TYP-DEL
زێدەباری تای ژ سنۆرێن ئازادی و دروستبوونا کەسایەتیا خوە دەربازی سنورێ سادە، تەنگ و بچوویک کەت	زێدەباری تاکی ژ سنۆرێن ئازادی و دروستبوونا کەسایەتیا خوە دەربازی سنورێ سادە، تەنگ و بچوویک کەت	TYP-DEL
چاوا گۆتارخوین و دەروێشان چەق و ایێن بەیتا زەمبیلفرۆشی ژبلی چەقێ رەوشتێ و گۆنی داتڕاشین، وەسا شێخ و مەلا هەمی چەقێن ئیسلامێ بانگەوازی بۆ کری، ل چێترادنا دادپەوەری و زانستێ ل سەر پەرستنێ، هەروەسا یەکسانی و پێکڤەژیان، کار و هەڤکاری و ئاڤەدانکرن و…، ل سەر دوبەرەگی و شەر، کەرب و کینێ	چاوا گۆتارخوین و دەروێشان چەق و تایێن بەیتا زەمبیلفرۆشی ژبلی چەقێ رەوشتێ و گۆنی داتڕاشین، وەسا شێخ و مەلا هەمی چەقێن ئیسلامێ بانگەوازی بۆ کری، ژ چێتراندنا دادپەوەری و زانستێ ل سەر پەرستنێ، هەروەسا یەکسانی و پێکڤەژیان، کار و هەڤکاری و ئاڤەدانکرن و…، ل سەر دوبەرەگی و شەر، کەرب و کینێ	GRM-FNW,TYP-DEL,TYP-DEL
بۆ من گەلەک یا سەیر بوو کا چاوا جهێ ڤان هەموو حزبان تێدا کرییە، د گەل وێ یەکێ ژی دا ب دیتنا وان هەر کەسێ سەرەدانا شێنێ نەکربيت هەروەکو سەرەدانا کوردستانێ نەکربیت	بۆ من گەلەک یا سەیر بوو کا چاوا جهێ ڤان هەموو حزبان تێدا کرییە، د گەل وێ یەکێ ژی دا ب دیتنا وان هەر کەسێ سەرەدانا شێنێ نەکربیت هەروەکو سەرەدانا کوردستانێ نەکربیت	SCR-YEH
پاپا فرانسیس ل ڤێ دوماهیێ د گۆتارەکێ دا گۆتبوو بۆ دووماهی ئینانا خوین رێتنێ ئەز یێ بەرهەڤم بچمە باکورێ عیراقێ و ناڤبژیڤانیێ د ناڤبەرا گرۆپ و ئالیان دا بکەم	پاپا فرانسیس ل ڤێ دووماهیێ د گۆتارەکێ دا گۆتبوو بۆ دووماهی ئینانا خوین رێتنێ ئەز یێ بەرهەڤم بچمە باکورێ عیراقێ و ناڤبژیڤانیێ د ناڤبەرا گرۆپ و ئالیان دا بکەم	TYP-DBL
محەمەدحەلبووسی:سوباهی کۆمبوونا جڤاتا نوونەران ژبۆ هەلبژارتنا سەرۆک کۆماری دێ هێتە ئەنجامدان	محەمەد حەلبووسی:سوباهی کۆمبوونا جڤاتا نوونەران بۆ هەلبژارتنا سەرۆک کۆماری دێ هێتە ئەنجامدان	GRM-FNW,SPC-MRG
چ باهۆز و ڕەشەبانه	چ باهۆز و ڕەشەبانە	SCR-HEH
ئێڤاریا رۆژا چوارشەمبی 11-11-2020 د رێورەسمەکێ تایبەتدا ل هولا رێڤەبەریا رەوشەنبیری و هونەری یا قەزا سێمێلێ و ب بەرهەڤبوونا ژمارەیەکا رەوشەنبیر و ئەدەب دۆستان یێن ل دەڤەرێ، د پەنەلێ ئێکێدا رۆمانڤیس (سەبری سلێڤانەیی) کورتیەک دەربارەیی دیروکا سەرهلدانا ڕۆمانێ و چاوانیا سەرەدەریکرنێ دگەل تێگەهان ب تایبەت دڤی بەرهەمیدا پێشکێشکر	ئێڤاریا رۆژا چوارشەمبی 11-11-2020 د رێورەسمەکێ تایبەتدا ل هولا رێڤەبەریا رەوشەنبیری و هونەری یا قەزا سێمێلێ و ب بەرهەڤبوونا ژمارەیەکا رەوشەنبیر و ئەدەب دۆستان یێن ل دەڤەرێ، د پەنەلێ ئێکێدا ڕۆمانڤیس (سەبری سلێڤانەیی) کورتیەک دەربارەیی دیروکا سەرهلدانا ڕۆمانێ و چاوانیا سەرەدەریکرنێ دگەل تێگەهان ب تایبەت دڤی بەرهەمیدا پێشکێشکر	SCR-DIA
هەروەسا یا ژهەمیان گرنگتر پرسا بودجە و موچەیی یاکو راستەوخو گرێدایی ژیانا خەلکیڤە کارئاسانی و هەستیارانە رەڤتار دگەل ڤی بابەتی بهێت کرن لەزاتیێ تێدا بکەن دا چ ڤالاهیێن دارایی ل هەرێمێ دروست نەبن هەروەکو جەنابێ سەروکێ حکومەتێ گوتی بودجا هەرێمێ گرێدایی بودجا حکومەتا عیراقێ یە	هەروەسا یا ژهەمیان گرنگتر پرسا بودجە و موچەیی یاکو راستەوخو گرێدایی ژیانا خەلکی ڤە کارئاسانی و هەستیارانە رەڤتار دگەل ڤی بابەتی بهێت کرن لەزاتیێ تێدا بکەن دا چ ڤالاهیێن دارایی ل هەرێمێ دروست نەبن هەروەکو جەنابێ سەروکێ حکومەتێ گوتی بودجا هەرێمێ گرێدایی بودجا حکومەتا عیراقێ یە	SPC-CLT
ئەڤرۆ ئێڤاری لسەر رێکا ئیبراهیم خەلیل رویدانەکا ترافیکی د ناڤبەرا ترومبێلەکا تەکسی و بارهەلگرەکێ دا چێبوو و شۆفێرێ تەکسیێ ژیانا خۆ ژ دەست دا	ئەڤرۆ ئێڤاری لسەر رێکا ئیبراهیم خەلیل رویدانەکا ترافیکی د ناڤبەرا ترۆمبێلەکا تەکسی و بارهەلگرەکێ دا چێبوو و شۆفێرێ تەکسیێ ژیانا خۆ ژ دەست دا	SCR-DIA
سەرەکی وەرزش سێمێل و گارە دێ بزاڤێن سەرکەفتنل ئێکێ کەن	سەرەکی وەرزش سێمێل و گارە دێ بزاڤێن سەرکەفتنا ئێکێ کەن	TYP-SUB
تێهنینە دایکێنل سەر ڕۆژ و مەهان	تێهنینە دایکێن ل سەر ڕۆژ و مەهان	SPC-MRG
سترانبێژ و شانۆڤان (میدیا نهێلی) کو نوکە ل وەلاتێ ئەلمانیا دژیت دیدارەکێ دا بۆ رۆژناما ئەڤرۆ گۆت: ل سالا 1984 من دەست ب کارێ شانۆیێ کریە و پشکداریا من یا ئێکێد شانۆگەریا(دەنگێ دایکێ) دا بوویە، ئەزسترانان ژی دبێژم، بەلێ پتر خۆ دکارێ شانۆیێ دا دبینم	سترانبێژ و شانۆڤان (میدیا نهێلی) کو نوکە ل وەلاتێ ئەلمانیا دژیت دیدارەکێ دا بۆ رۆژناما ئەڤرۆ گۆت: ل سالا 1984 من دەست ب کارێ شانۆیێ کریە و پشکداریا من یا ئێکێ د شانۆگەریا(دەنگێ دایکێ) دا بوویە، ئەزسترانان ژی دبێژم، بەلێ پتر خۆ دکارێ شانۆیێ دا دبینم	SPC-MRG
زەهرە جەباری، سەرۆکا لیژنا ڤەگوهاستن و پەیوەندیێن پەرلەمانێ عیراقێ گوت: د بودجهیێن ساڵێن دەربازبوویدا عیراقێ بزاڤ کرینە ب رێکا باجێ لسەر کارتێن باڵانسێن موبایلان، بودجەیێ عیراقێ زێدەبکەت	زەهرە جەباری، سەرۆکا لیژنا ڤەگوهاستن و پەیوەندیێن پەرلەمانێ عیراقێ گوت: د بودجەیێن ساڵێن دەربازبوویدا عیراقێ بزاڤ کرینە ب رێکا باجێ لسەر کارتێن باڵانسێن موبایلان، بودجەیێ عیراقێ زێدەبکەت	SCR-HEH
