نوێنەرێ هەردەمی یێ عیراقێ ل رێکخراوێن نیڤدەولەتی ل ڤیەننا ، باڵیۆز بەکر فەتاح حسێن سەرپەرشتیا 11ەمین کۆمبوونا کۆنفرانسێ بەرهنگاربوونا تاوانێن رێکخراوێن نێڤدەولەتی کر ، دکۆمبوونێ دا هەژمارەکا پرۆژەیان بۆ بەرهنگاربوونا تاوانێن رێکخراوێن نیڤدەولەتی ، وەک بازرگانی کرن ب مرۆڤان و نازرگانییا ماددەیێن هشبەر و قاچاخچیاتی و چەند تاوانەکێن دی لسەر ئاستێ جيهانێ گۆتۆبێژ کرن	نوێنەرێ هەردەمی یێ عیراقێ ل رێکخراوێن نیڤدەولەتی ل ڤیەننا ، باڵیۆز بەکر فەتاح حسێن سەرپەرشتیا 11ەمین کۆمبوونا کۆنفرانسێ بەرهنگاربوونا تاوانێن رێکخراوێن نێڤدەولەتی کر ، دکۆمبوونێ دا هەژمارەکا پرۆژەیان بۆ بەرهنگاربوونا تاوانێن رێکخراوێن نیڤدەولەتی ، وەک بازرگانی کرن ب مرۆڤان و نازرگانییا ماددەیێن هشبەر و قاچاخچیاتی و چەند تاوانەکێن دی لسەر ئاستێ جیهانێ گۆتۆبێژ کرن	SCR-YEH
وەزیرێ دەرڤەیێ ئیراقێ، فوئاد حسێن، داخواز ژ جفاکێ نێڤدەولەتی کر پشتەڤانی و هاریکاریێن زێدەتر پێشکێشی پەنابەرێن سووری ل ئیراقێ بکەت	وەزیرێ دەرڤەیێ ئیراقێ، فوئاد حسێن، داخواز ژ جڤاکێ نێڤدەولەتی کر پشتەڤانی و هاریکاریێن زێدەتر پێشکێشی پەنابەرێن سووری ل ئیراقێ بکەت	SCR-DIA
پاریس سان جێرمان بزاڤا بدەست ڤە ئینانا شیانێن تیو هێرناندێزی کەن	پاریس سان جێرمان بزاڤا بدەست ڤە ئینانا شیانێن تیو هێرناندێزی دکەن	TYP-DEL
دیدارا تلی بەت – دەزگەهێ میدیایێ بادینان	دیدارا تایبەت – دەزگەهێ میدیایێ بادینان	SPC-SPL,TYP-SUB
یۆری کنۆتۆڤ شارەزایێ سەربازیێ رۆسی بۆ رۆژنامەیا (ئەزڤێستیا) دبێژیت: گوللەیا تڤەنگا ستالینگراد هزا و 500 مێتران دچیت و هەر ساجۆرەکێ وێتێرا پێنج گوللەیان دکەت و گەلەک ب هویری ئارمانجێ دهنگێڤیت	یۆری کنۆتۆڤ شارەزایێ سەربازیێ رۆسی بۆ رۆژنامەیا (ئەزڤێستیا) دبێژیت: گوللەیا تڤەنگا ستالینگراد هزار و 500 مێتران دچیت و هەر ساجۆرەکێ وێ تێرا پێنج گوللەیان دکەت و گەلەک ب هویری ئارمانجێ دهنگێڤیت	TYP-DEL,SPC-MRG
ڕاوین دەڵێت: “تیۆرە زانستی و کۆمەڵایەتیەکانی جێندەر، تیۆری تازەن، لە بنەڕەتدا لە ڕۆژئاوا سەریان هەڵداوە	ڕاوین دەڵێت: “تیۆرە زانستی و کۆمەڵایەتییەکانی جێندەر، تیۆری تازەن، لە بنەڕەتدا لە ڕۆژئاوا سەریان هەڵداوە	TYP-DBL
لەورا ئەگەر ب هاریکاریا ڤان کەرتان قانونەک بهیتە دەرکرن	لەورا ئەگەر ب هاریکاریا ڤان کەرتان قانوونەک بهێتە دەرکرن	SCR-DIA,TYP-DBL
تو ژی ب چارگاڤ د چوویە سەر گووفکێ سۆتی و تە خوە دگەڤازت و تو ب وان دکەنی و وان جووتک دههڤدو وەردکرن	تو ژی ب چارگاڤ د چوویە سەر گووفکێ سۆتی و تە خوە دگەڤازت و تو ب وان دکەنی و وان جووتک دهەڤدو وەردکرن	SCR-HEH
هەر د ڤێ دەربارێ دا ل باکورێ کوردستانێ ژی ل هەموو باژێران خوەنیشادانێن بۆ شەرمزارکرنا کریاێرن تیرۆرستان و هەڤکاریا تورکیا بۆ دۆژمنێن گەلێ کورد سازکرن و راگەهاندن کو ئەو ب جان و مال و خوینا خوە ل گەل باشور و رۆژئاڤایێ کوردستانێ نە و سۆزا پشتەڤانیا تەمام بۆ هەردو پارچەیێن کوردستانێ دان	هەر د ڤێ دەربارێ دا ل باکورێ کوردستانێ ژی ل هەموو باژێران خوەنیشادانێن بۆ شەرمزارکرنا کریارێن تیرۆرستان و هەڤکاریا تورکیا بۆ دۆژمنێن گەلێ کورد سازکرن و راگەهاندن کو ئەو ب جان و مال و خوینا خوە ل گەل باشور و رۆژئاڤایێ کوردستانێ نە و سۆزا پشتەڤانیا تەمام بۆ هەردو پارچەیێن کوردستانێ دان	TYP-TRA
د کۆمبوونێ دا بەحسی کارەساتائەنفال و کیمیابارانکرنا هەلەبجە و سیاسەتا دژی مرۆڤایەتییێ یا بەعسییان ل دژی گەلی مە هاتە کرن	د کۆمبوونێ دا بەحسی کارەساتا ئەنفال و کیمیابارانکرنا هەلەبجە و سیاسەتا دژی مرۆڤایەتییێ یا بەعسییان ل دژی گەلێ مە هاتە کرن	SPC-MRG,SCR-DIA
سەرەکیفەیسبۆک 23 هزار فەرمانبەرێن دهۆکێ مافێ وەرگرتنا پارچە ئەردان هەیە	سەرەکی فەیسبۆک 23 هزار فەرمانبەرێن دهۆکێ مافێ وەرگرتنا پارچە ئەردان هەیە	SPC-MRG
د ماوێ هەشت هەیڤێن بۆریدا 001 گەنجێن کورد یێن هەرێما کوردستانێ پەیوەندی ب رێکخراوا تیرۆرستیا داعش ڤە کربوو	د ماوێ هەشت هەیڤێن بۆری دا 001 گەنجێن کورد یێن هەرێما کوردستانێ پەیوەندی ب رێکخراوا تیرۆرستیا داعش ڤە کربوو	SPC-CLT
ڤیدیۆ: ژین و ژیرا وەلاتیان ل بن دەسەلاتا داعش	ڤیدیۆ: ژین و ژیارا وەلاتیان ل بن دەسەلاتا داعش	TYP-DEL
حەفتیا بهێت30هزار کارتێن دەنگدانێ دێ ڤەگەرنە دهۆکێ	حەفتیا بهێت 30 هزار کارتێن دەنگدانێ دێ ڤەگەرنە دهۆکێ	SPC-MRG,SPC-MRG
ل دووڤ نڤیسارەکا وەزارەتا دارایی کو ئیمزایا یاسین واحید ئیسماعیل، رێڤەبەرێ گشتی یێ دیوانا وەزارەتا دارایی و ئابووری یا حکومەتا هەرێما کوردستانێ ل سەر و ب ژمارە 4633 ل رێککەڤتی 4 هەیڤا 9 یا سالا 2022 دەرکەڤتیە، راگەهاندیە، وەزارەتا دارایی بڕیاردا یە دەمێ دەواما فەرمانبەرێن خۆ ژ دەمژمێر 8 سپێدێ بۆ 3 پشتی نیڤرۆ درێژ بکەت	ل دووڤ نڤیسارەکا وەزارەتا دارایی کو ئیمزایا یاسین واحید ئیسماعیل، رێڤەبەرێ گشتی یێ دیوانا وەزارەتا دارایی و ئابووری یا حکومەتا هەرێما کوردستانێ ل سەر و ب ژمارە 4633 ل رێککەڤتی 4 هەیڤا 9 یا سالا 2022 دەرکەڤتیە، راگەهاندیە، وەزارەتا دارایی بڕیاردایە دەمێ دەواما فەرمانبەرێن خۆ ژ دەمژمێر 8 سپێدێ بۆ 3 پشتی نیڤرۆ درێژ بکەت	SPC-CLT
هەمی وێنە یادگارنێن تە	هەمی وێنە یادگاریێن تە	TYP-SUB
زێدەتر گۆت: (چەندین جاران مە جهێن شولەژێ ل سەر فێ یەکێ ئاگەهدارکرینه، بەلێ دیارە کو رەوشا دارایی یا هەرێما کوردستانێ یا گونجای نەبوویە وەکو پێدڤی هاریکاری بۆ جوتیاران بهێنەکرن کو ل سەر کارێن خوە بەردەوام بن ، بەلێ ب هەر رەنگێ بیت پێدڤیە بازارەک بۆ فرۆتنا مریشکا دەڤەرێ بهێتە پەیداکرن داکو جوتیار بشێن ل سەر کارێن خوە بەردەوام بن)	زێدەتر گۆت: (چەندین جاران مە جهێن شولەژێ ل سەر ڤێ یەکێ ئاگەهدارکرینه، بەلێ دیارە کو رەوشا دارایی یا هەرێما کوردستانێ یا گونجای نەبوویە وەکو پێدڤی هاریکاری بۆ جوتیاران بهێنەکرن کو ل سەر کارێن خوە بەردەوام بن ، بەلێ ب هەر رەنگێ بیت پێدڤیە بازارەک بۆ فرۆتنا مریشکا دەڤەرێ بهێتە پەیداکرن داکو جوتیار بشێن ل سەر کارێن خوە بەردەوام بن)	SCR-DIA
سەرۆک بافڵ جەلال تاڵەبانی پەیامەکی ئاڕاستەی خوێندکاران دەکەت و دبێژیت: وەڵاتێ مە پێدڤی ب شیان و لیهاتنێن هەوە هەیە و مە ئۆمێدەکا زۆر لسەر پاشەرۆژا هەوە دانایە	سەرۆک بافڵ جەلال تاڵەبانی پەیامەکی ئاڕاستەی خوێندکاران دەکەت و دبێژیت: وەڵاتێ مە پێدڤی ب شیان و لێهاتنێن هەوە هەیە و مە ئۆمێدەکا زۆر لسەر پاشەرۆژا هەوە دانایە	SCR-DIA
ل دووماهیێ دیارکر” هکەە ئەڤ ئالۆزیە بڤی رەنگیبەردەوامبن دێ ئیراقێ بەر ب شەڕەکێ خویناوی بەن”	ل دووماهیێ دیارکر” هەکە ئەڤ ئالۆزیە بڤی رەنگی بەردەوامبن دێ ئیراقێ بەر ب شەڕەکێ خویناوی بەن”	SPC-MRG,TYP-TRA
باندۆرا سیاسەتێ ل سەرکەسی	باندۆرا سیاسەتێ ل سەر کەسی	SPC-MRG
شڤان پەروەر د دیدارەکا رۆژنامەڤانی دا دیارکر کو هاتنا من بۆ بەرلینێ بۆ ئەنجامدانا کارەکێ هونەری یە بۆ (شنگال و کۆبانێ) و مژوولی تۆمارکرنێ بوویە، زێدەتر گۆت: دیسا بەری نوکە ژی من ستران ل سەر پێشمەرگێ کوردستانێ بەرهەڤکر یە و دیسا بەرخودانا کوردان وەک گەریلا و پێشمەرگێ کوردستانێ و برایەتیا کوردان و ئەڤ سترانە بڤێ مەبەستێ هاتیە ئامادەکرن	شڤان پەروەر د دیدارەکا رۆژنامەڤانی دا دیارکر کو هاتنا من بۆ بەرلینێ بۆ ئەنجامدانا کارەکێ هونەری یە بۆ (شنگال و کۆبانێ) و مژوولی تۆمارکرنێ بوویە، زێدەتر گۆت: دیسا بەری نوکە ژی من ستران ل سەر پێشمەرگێ کوردستانێ بەرهەڤکریە و دیسا بەرخودانا کوردان وەک گەریلا و پێشمەرگێ کوردستانێ و برایەتیا کوردان و ئەڤ سترانە بڤێ مەبەستێ هاتیە ئامادەکرن	SPC-CLT
جەستەیێ مومیاکریێ زارۆکەکا تەمەن دو ساڵی بکارهینەرێن پێگەهێن کۆمەڵایەتی حێبەتی کرن، ژبەرکو جوانترین مومیایە دجیهانێدا، ماوێ 100 ساڵایە جەستە و روخسارێ وێ ب شێوەیەکێ سەیر هاتینە پاراستن و وەسا خویا دکەن کو یا نڤستی یە	جەستەیێ مومیاکریێ زارۆکەکا تەمەن دوو ساڵی بکارهینەرێن پێگەهێن کۆمەڵایەتی حێبەتی کرن، ژبەرکو جوانترین مومیایە دجیهانێدا، ماوێ 100 ساڵایە جەستە و روخسارێ وێ ب شێوەیەکێ سەیر هاتینە پاراستن و وەسا خویا دکەن کو یا نڤستی یە	TYP-DBL
د بریارەکا نویدا، رێڤەبەریا گومرکێن هەرێمێ رێژەیا گومرکێ ل سەرمۆبایلان ژ 10% بۆ 5% کێم کر	د بریارەکا نویدا، رێڤەبەریا گومرکێن هەرێمێ رێژەیا گومرکێ ل سەر مۆبایلان ژ 10% بۆ 5% کێم کر	SPC-MRG
چامەیا نالی و برەسڤا سالم بەشێوەیێ ستران هاتە بەلاڤکرن	چامەیا نالی و بەرسڤا سالم بەشێوەیێ ستران هاتە بەلاڤکرن	TYP-TRA
سعودیە ژ پەیوەندیێن مسرو ئەمریکا دلگرانە	سعوودیە ژ پەیوەندیێن مسر و ئەمریکا دلگرانە	TYP-DBL,SPC-MRG
ئەم ب تەمامی ەمخۆرێن ئارامی و سەقامگیریێ ینە ل سەر سنۆرێن مە یێن هەڤپشک و ب هەموو شیانان ئەم بەرهەڤین بۆ چارەسەرکرنا هەموو ئاریشان ب گیانێ رێزگرتنا دوئالی و هەڤسوویاتیێ	ئەم ب تەمامی خەمخۆرێن ئارامی و سەقامگیریێ ینە ل سەر سنۆرێن مە یێن هەڤپشک و ب هەموو شیانان ئەم بەرهەڤین بۆ چارەسەرکرنا هەموو ئاریشان ب گیانێ رێزگرتنا دوئالی و هەڤسوویاتیێ	TYP-DEL
لێ دەویێپێ نائینست	لێ داویێ پێ نائینیت	SPC-MRG,TYP-SUB,TYP-SUB
کارێ هزرێ ئەوە تاک د گریمانا فرەرەنگیێ دا خوە پێش بێخیت و زانستێ کۆمەلناسی و مرۆڤناسی هەر زویکا دهست نیشانبکەت، داکو دبوارێ وێنەیێ مرۆڤبوونێ دا ببیتە هەلگرێ (بوون و دونیایەکا) راستەقینە	کارێ هزرێ ئەوە تاک د گریمانا فرەرەنگیێ دا خوە پێش بێخیت و زانستێ کۆمەلناسی و مرۆڤناسی هەر زویکا دەست نیشانبکەت، داکو دبوارێ وێنەیێ مرۆڤبوونێ دا ببیتە هەلگرێ (بوون و دونیایەکا) راستەقینە	SCR-HEH
سەرەکی گۆتار دوڤچوونا کومسیۆنا هەلبژارتان سیاسی یە یان پێشەیی یە	سەرەکی گۆتار دووڤچوونا کومسیۆنا هەلبژارتان سیاسی یە یان پێشەیی یە	TYP-DBL
سترانبێژەکێ گەنج بۆ ئێکەمین جار سترانەکێ ب نافێ (بەستەیەکا بریندار) ب روودانێن 16 ئوکتۆبەرا 2017 دبێژیت	سترانبێژەکێ گەنج بۆ ئێکەمین جار سترانەکێ ب ناڤێ (بەستەیەکا بریندار) ب روودانێن 16 ئوکتۆبەرا 2017 دبێژیت	SCR-DIA
رێڤەبەریا گشتی یا ساخلەمیا پارێزگەها دهوک دچالاکیەکێدا ب روژا جیهانیا پەنجەشێرا مەمکی ساخکرو تێدا چەندین بابەتێن گرنگ نیشاندان , ژلایێ خوڤە د	رێڤەبەریا گشتی یا ساخلەمیا پارێزگەها دهوک دچالاکیەکێ دا ب روژا جیهانیا پەنجەشێرا مەمکی ساخکرو تێدا چەندین بابەتێن گرنگ نیشاندان , ژلایێ خوڤە د	SPC-CLT
وەکی ل سەری مە ئاماژە ب فرەلایەنییا ئێکگرتنێ دایی، یا گرنگە ئێکگرتن د هەمی رەهەندێن خۆ دا بهێتە کاراکرن و بتنێ ئێکگرتنەکا دەمکی و کارتۆني نەبیت	وەکی ل سەری مە ئاماژە ب فرەلایەنییا ئێکگرتنێ دایی، یا گرنگە ئێکگرتن د هەمی رەهەندێن خۆ دا بهێتە کاراکرن و بتنێ ئێکگرتنەکا دەمکی و کارتۆنی نەبیت	SCR-YEH
یانژی زانکۆ هاتنە ئاڤاکرن دا کو مرۆڤ فێری جۆرێن مودێلات، خوە عەرزکرن و باوەرنامەێن سەختە ببیت	یان ژی زانکۆ هاتنە ئاڤاکرن دا کو مرۆڤ فێری جۆرێن مودێلات، خوە عەرزکرن و باوەرنامەێن سەختە ببیت	SPC-CLT
خەیری زیبان، خویاکر” بڕیارا هەولوەشاندنا هووربینیا ئەمنی بڕیارەکا مەترسیدارە ل سەر ژیانا ئێزدیان ژ بەر کو هەکە ئەو پرۆسەیە نەبیت ڕامانا وێ چەندی یە کو حوکمەتا ئیراقێ بڕیارا ئازادکرنا گشتی بۆ وان کەسان دایە یێن دگەل تیرۆرستێن داعشێ کو ئێزدی تووشی جینوسایدی کرین ل 2014ێ ژبەر فی ئێکێ ژی ئێزدی گەلەک دلگران و بێ ئومید بووینە بۆ زڤرینا شنگالێ”	خەیری زیبان، خویاکر” بڕیارا هەولوەشاندنا هووربینیا ئەمنی بڕیارەکا مەترسیدارە ل سەر ژیانا ئێزدیان ژ بەر کو هەکە ئەو پرۆسەیە نەبیت ڕامانا وێ چەندی یە کو حوکمەتا ئیراقێ بڕیارا ئازادکرنا گشتی بۆ وان کەسان دایە یێن دگەل تیرۆرستێن داعشێ کو ئێزدی تووشی جینوسایدی کرین ل 2014ێ ژبەر ڤی ئێکێ ژی ئێزدی گەلەک دلگران و بێ ئومید بووینە بۆ زڤرینا شنگالێ”	SCR-DIA
شاندەکێ پارتی پشکدارن د کۆمبوونێن لاوەکی یێن مافێ مرۆڤی دا کر، د کۆمبوو نێ دا کێشەیا گەلێ مە و سیاسەتا رەگەزپەرستا بەعسییان بۆ بەرهەڤبوویان شرۆڤەکر و داخواز ژ جڤاکێ ناڤدەولەتی کر ل دۆر سەرکوتکاریێن بەعسیێن ئیراقێ بێدەنگیێ بشکێنن	شاندەکێ پارتی پشکداری د کۆمبوونێن لاوەکی یێن مافێ مرۆڤی دا کر، د کۆمبوونێ دا کێشەیا گەلێ مە و سیاسەتا رەگەزپەرستا بەعسییان بۆ بەرهەڤبوویان شرۆڤەکر و داخواز ژ جڤاکێ ناڤدەولەتی کر ل دۆر سەرکوتکاریێن بەعسیێن ئیراقێ بێدەنگیێ بشکێنن	SPC-SPL,TYP-SUB
یوسف سەبری: بەلێ دێ گوهۆڕین ب سەر پەیکەرێ حزبی دا هێن، وەکو د بابەتێ پلەیا جێگرێ سەروکێ پارتی دا و هەروەسان دێ هندەک ئۆرگانێن ئاست بلند کو گرێدای ب سەرۆکێ پارتی ڤەبن هێنە دامەزراندن ولسەر ئاستێ پارێزگەهان ژی دێ ئۆرگانەکا تایبەت هێتە دامەزراندن بۆ سەرپەرشتیکرنا ڕێکخستنا حزبی ل پارێزگەهێ دا	یوسف سەبری: بەلێ دێ گوهۆڕین ب سەر پەیکەرێ حزبی دا هێن، وەکو د بابەتێ پلەیا جێگرێ سەروکێ پارتی دا و هەروەسان دێ هندەک ئۆرگانێن ئاست بلند کو گرێدای ب سەرۆکێ پارتی ڤەبن هێنە دامەزراندن و لسەر ئاستێ پارێزگەهان ژی دێ ئۆرگانەکا تایبەت هێتە دامەزراندن بۆ سەرپەرشتیکرنا ڕێکخستنا حزبی ل پارێزگەهێ دا	SPC-MRG
کارناما حکومەتا سودانی ئەوا پێشکێشی جڤاتا نونەران کری، چەندین خالێن گرنگ بخۆڤە دگریت وەکو تیور دخزمەتا خەلکێ عیراقێدانە، یا گرنگتر ئەو خال و بڕگەنە یێن پەیوەندی د کێشەیێن هەلاویستی ڤە هەی دناڤبەرا هەرێما کوردستانێ و حکومەتا فیدراڵیدا، ئەگەر بهێنە جێبەجێکرن دێ وەڵات بگشتی بەرەڤ ئاسویەکێ دی چیت	کارناما حکومەتا سودانی ئەوا پێشکێشی جڤاتا نوونەران کری، چەندین خالێن گرنگ بخۆڤە دگریت وەکو تیور دخزمەتا خەلکێ عیراقێدانە، یا گرنگتر ئەو خال و بڕگەنە یێن پەیوەندی ب کێشەیێن هەلاویستی ڤە هەی دناڤبەرا هەرێما کوردستانێ و حکومەتا فیدراڵیدا، ئەگەر بهێنە جێبەجێکرن دێ وەڵات بگشتی بەرەڤ ئاسویەکێ دی چیت	TYP-DBL,GRM-FNW
سەردەمی کۆڕونایێ سەردەمەکێ ب ترس چارەنڤیس نەدیار بوو، شەڤ و رۆژ ئێک بوون، دەرنەکەڤە، نەچە دەستێ کەسێ، بەردەڤک و دەستگۆرکان بکاربینە، فلانە کەس کۆڕونایێ گرت، فلانە دەڤەر چەند حالەتەک لێ دیار بوون، فلان و بێڤان مرن	سەردەمێ کۆڕونایێ سەردەمەکێ ب ترس چارەنڤیس نەدیار بوو، شەڤ و رۆژ ئێک بوون، دەرنەکەڤە، نەچە دەستێ کەسێ، بەردەڤک و دەستگۆرکان بکاربینە، فلانە کەس کۆڕونایێ گرت، فلانە دەڤەر چەند حالەتەک لێ دیار بوون، فلان و بێڤان مرن	SCR-DIA
ب ڤیدیو: دەست ب راکرنا قفلێن ئەڤینداران هاتە كرن	ب ڤیدیو: دەست ب راکرنا قفلێن ئەڤینداران هاتە کرن	SCR-KAF
ڕێفەبەرییا گشتییا سەقاناسیێ ڕاگەهاند، دهێتە پێشبینیکرن دچەند ڕۆژێن داهاتی دا پلەیێن گەرمێ ل سەرانسەری هەرێمێ بۆ ئاستەکێ زۆر بلندببن و ل پارێزگەها دهوک بگەهنە 44 پلەیێن سیلیزی	ڕێڤەبەرییا گشتییا سەقاناسیێ ڕاگەهاند، دهێتە پێشبینیکرن دچەند ڕۆژێن داهاتیدا پلەیێن گەرمێ ل سەرانسەری هەرێمێ بۆ ئاستەکێ زۆر بلندببن و ل پارێزگەها دهوک بگەهنە 44 پلەیێن سیلیزی	SCR-DIA,SPC-CLT
لەورا هەردەم مە دەرگەهێن دیالۆگ و دانوستاندنێ د ڤەکری هێلان و رێکەچارەیا ئاشتیانە یا ئاریشێن مە ل نک مە باشتر بوو و چو دەمان مە دانوستاندن رەت نەکرینە	لەورا هەردەم مە دەرگەهێن دیالۆگ و دانوستاندنێ ب ڤەکری هێلان و رێکەچارەیا ئاشتیانە یا ئاریشێن مە ل نک مە باشتر بوو و چو دەمان مە دانوستاندن رەت نەکرینە	GRM-FNW
بێوای گۆتژی: “گەلەک زیانێن ماددی گەهشتینە وهلاتیان هەتا دوهی سپێدی 27/11/2022ێ هێشتا هندەک جە نەهاتبوونە تۆمارکرن یێن زیان گەهشتیێ، لیژنێن مە دێ ناڤێ وان وەلاتیێن زیان گەهشتیێ تۆمار کەن”	بێواری گۆتژی: “گەلەک زیانێن ماددی گەهشتینە وەلاتیان هەتا دوهی سپێدی 27/11/2022ێ هێشتا هندەک جە نەهاتبوونە تۆمارکرن یێن زیان گەهشتیێ، لیژنێن مە دێ ناڤێ وان وەلاتیێن زیان گەهشتیێ تۆمار کەن”	TYP-DEL,SCR-HEH
ئەرێ دروستە د تنێ برێڤەبچم یان نە	ئەرێ دروستە ب تنێ برێڤەبچم یان نە	GRM-FNW
ڤۆلۆدیمێر زیلینسکی سەرۆکێ ئۆکرانیا راگەهاند: هێزێن ئۆکرانیا حەفتییا ۆبری شیاینە 776 کێلۆمێترێن چوارگۆشە و 29 باژێڕکان ل رۆژهەلات و 500 کیلۆمێترێن چوارگۆش ل باشوورێ ئۆکرانیا رزگار بکەن	ڤۆلۆدیمێر زیلینسکی سەرۆکێ ئۆکرانیا راگەهاند: هێزێن ئۆکرانیا حەفتییا بۆری شیاینە 776 کێلۆمێترێن چوارگۆشە و 29 باژێڕکان ل رۆژهەلات و 500 کیلۆمێترێن چوارگۆشە ل باشوورێ ئۆکرانیا رزگار بکەن	TYP-TRA,TYP-DEL
جەمال گۆتژی: “وەکو هەستەکێ مەزن بۆ پێشمەرگێنگیانێ خوە دکەنە قوربان بۆ ئاخا كوردستانێ وەکو هەستەکێ نەتەوەی مە ئەڤ سروودە چێکریە”	جەمال گۆتژی: “وەکو هەستەکێ مەزن بۆ پێشمەرگێن گیانێ خوە دکەنە قوربان بۆ ئاخا کوردستانێ وەکو هەستەکێ نەتەوەی مە ئەڤ سروودە چێکریە”	SPC-MRG,SCR-KAF
4 مستەفێ هاشمی 5 ئیسحاق جیهانگیر 6 مستەفێ میر سەلیم کو دێ ژ بۆ ڤێ ئێکێ 27 رۆژان بانگەشەیا هەلبژارتنان یا بەردەوام بیت، ئەو ژی ژ 21\4\2017 و هەتا 17\5 \2017 وەسا دیارە کو د ڤان هەلبژارتنان دا دێ هەڤرکیەكا هەرە گەرم هەبیت د ناڤبەرا حەسەن رۆحانی و ئیبراهیم رەئیسی دا	4 مستەفێ هاشمی 5 ئیسحاق جیهانگیر 6 مستەفێ میر سەلیم کو دێ ژ بۆ ڤێ ئێکێ 27 رۆژان بانگەشەیا هەلبژارتنان یا بەردەوام بیت، ئەو ژی ژ 21\4\2017 و هەتا 17\5 \2017 وەسا دیارە کو د ڤان هەلبژارتنان دا دێ هەڤرکیەکا هەرە گەرم هەبیت د ناڤبەرا حەسەن رۆحانی و ئیبراهیم رەئیسی دا	SCR-KAF
باهیێ پەترۆلێ ئەڤرۆ 2%ێ بنلد بوو	بهایێ پەترۆلێ ئەڤرۆ 2%ێ بنلد بوو	TYP-TRA
کیش دەزگایێحکومەتێبەرپسیارە	کیش دەزگایێ حکومەتێ بەرپسیارە	SPC-MRG,SPC-MRG
