ئ5ەسمان دێ ئەورێن كێم بۆ ئەورێن بچووک هێتە گوهۆڕین و پاشان ژی بیتە ساهی	5ئەسمان دێ ئەورێن کێم بۆ ئەورێن بچووک هێتە گوهۆڕین و پاشان ژی بیتە ساهی	SCR-KAF,TYP-TRA
واش دەزانن کە رەڵام نادرێنەوە گوایە هەق بە لای ئەوانەوەيە	واش دەزانن کە وەڵام نادرێنەوە گوایە هەق بە لای ئەوانەوەیە	SCR-YEH,TYP-SUB
گومد و ژیان 7-1-2021 – دەزگەهێ میدیایێ بادینان	گوند و ژیان 7-1-2021 – دەزگەهێ میدیایێ بادینان	TYP-SUB
د وینە … ماکرون ل کەنیسا ساعە ل باژێڕێ موسڵ – دەزگەهێ میدیایێ بادینان	ب وێنە … ماکرون ل کەنیسا ساعە ل باژێڕێ موسڵ – دەزگەهێ میدیایێ بادینان	SCR-DIA,GRM-FNW
ئەو بوو حکومەتا کوردستانێ ژبۆ جهێ باوەریا گالێ مە و حێبەتیبوونا جڤاکا نێڤدەولەتی	ئەو بوو حکومەتا کوردستانێ بۆ جهێ باوەریا گەلێ مە و حێبەتیبوونا جڤاکا نێڤدەولەتی	TYP-SUB,GRM-FNW
گەلەک ژ خەلکێ باژێری پشتی ژ نۆچە یێن کۆڕونایێ بێزار بووین و د مال دا شڕ بووین و مابوونە بێ وگر دەست ب هەڤالینیا پەرتووکا کرن	گەلەک ژ خەلکێ باژێری پشتی ژ نۆچەیێن کۆڕونایێ بێزار بووین و د مال دا شڕ بووین و مابوونە بێ هوگر دەست ب هەڤالینیا پەرتووکا کرن	TYP-DEL,SPC-SPL
زێرەڤانگویل _ زاخۆ	زێرەڤان گولی _ زاخۆ	SPC-MRG,TYP-TRA
زارفەکەرا شۆخ و شەنگ (سازە سەعید) دیارکر کو د تنێ ل هەرێما کوردستانێ تەماشەی جوانیا زارڤەکەرا کچان دهێتەکرن	زارڤەکەرا شۆخ و شەنگ (سازە سەعید) دیارکر کو ب تنێ ل هەرێما کوردستانێ تەماشەی جوانیا زارڤەکەرا کچان دهێتەکرن	SCR-DIA,GRM-FNW
پەلاماردانی تێرۆریستانی القاعیدە بۆ سەر هەردو تاوەری بازرگانیی جیهان لە یانزدەی سێپتامبری 2001یشدا مێژویسیاسەتی دنیای گۆڕی و ئەمریکا سیستمی تاک جەمسەریی زیاتر بوە چوەسەر تا خۆی سەرکودایەتیی جیهان بکات بۆ رەواندنەوەی هەڕەشەی تێرۆریستان کە لەو رۆژەوە تا ئەمڕۆ ئەو سەرکردایەتییەی ئەمریکا بەردەوامە	پەلاماردانی تێرۆریستانی القاعیدە بۆ سەر هەردو تاوەری بازرگانیی جیهان لە یانزدەی سێپتامبری 2001یشدا مێژویسیاسەتی دنیای گۆڕی و ئەمریکا سیستمی تاک جەمسەریی زیاتر بوە چوەسەر تا خۆی سەرکردایەتیی جیهان بکات بۆ رەواندنەوەی هەڕەشەی تێرۆریستان کە لەو رۆژەوە تا ئەمڕۆ ئەو سەرکردایەتییەی ئەمریکا بەردەوامە	TYP-SUB
ژ وی گرۆپی، قەتەرێ چ خال نینن و دەرکەفتنا وێ ژ مۆندیالێ ئێکلا بوویە، لێ هەرسێ هەلبژارتیێن دی دەلیڤەیا دەربازبوونێ هەیە، ژبەر کو هەر ئێک ژ هۆلەن دا و ئکوادۆرێ چار خال هەنە و سنیگالێ ژی سێ خال هەنە	ژ وی گرۆپی، قەتەرێ چ خال نینن و دەرکەفتنا وێ ژ مۆندیالێ ئێکلا بوویە، لێ هەرسێ هەلبژارتیێن دی دەلیڤەیا دەربازبوونێ هەیە، ژبەر کو هەر ئێک ژ هۆلەندا و ئکوادۆرێ چار خال هەنە و سنیگالێ ژی سێ خال هەنە	SPC-CLT
گوتژی هەر ئەو ئیرادەیا ئێکەتیێ یە و پشتڕاستین دێ وێ ئیرادێ ب سەرئێخین	گووت ژی هەر ئەو ئیرادەیا ئێکەتیێ یە و پشتڕاستین دێ وێ ئیرادێ ب سەرئێخین	TYP-DBL,SPC-CLT
لێ د شۆرشا گولانێ دا رەوش گەلەک گەلەک جودا بو و کارەکێ گەلەک د زەحمەت بوو دوبارە شۆرش سەرهلدەت و گەلێ کورد ل ئێک کۆم ببیت و ژبەر ڤان ئەگەران:	لێ د شۆرشا گولانێ دا رەوش گەلەک گەلەک جودا بوو و کارەکێ گەلەک ب زەحمەت بوو دوبارە شۆرش سەرهلدەت و گەلێ کورد ل ئێک کۆم ببیت و ژبەر ڤان ئەگەران:	GRM-FNW,TYP-DBL
ل زۆا کەسک شەر و تەقەیەکا مەزنە	ل زۆنا کەسک شەڕ و تەقەیەکا مەزنە	TYP-DEL,SCR-DIA
نێچیرڤان بارزانی، سەرۆکی هەرێما کوردستانێ ل گەل موسەننا سامەرایی، سەرۆکێ هەڤپەیمانیا عەزم یا سوننی ل بەغدا کۆمبوو و ب گۆرەی بەیاننامەیەکا سەرۆکایەتیا هەرێما کوردستانێ، هەردو ئالیان دووپاتی ل پێدڤیو گرنگیا هاریکاریا هەڤپشک یا هێز و ئالیێن ئیراقی بۆ دەربازکرنا ئاستەنگان کر	نێچیرڤان بارزانی، سەرۆکی هەرێما کوردستانێ ل گەل موسەننا سامەرایی، سەرۆکێ هەڤپەیمانیا عەزم یا سوننی ل بەغدا کۆمبوو و ب گۆرەی بەیاننامەیەکا سەرۆکایەتیا هەرێما کوردستانێ، هەردو ئالیان دووپاتی ل پێدڤی و گرنگیا هاریکاریا هەڤپشک یا هێز و ئالیێن ئیراقی بۆ دەربازکرنا ئاستەنگان کر	SPC-MRG
ل لایەکێ دی ڤە و سەبارەت کواڵێتیا جۆرێ وان کەل و پەلێن خۆراکی یێن هەیڤانه ب سەر وەلاتیێن هەرێما کوردستانێ دهێنە دابەشکرن ، وەزیرێ بازرگانی گووت : هەمان جۆرێ وي خۆراکی یە یێ ل سەرتاسەری عیراقێ دهێتە دابەشکرن	ژ لایەکێ دی ڤە و سەبارەت کواڵێتیا جۆرێ وان کەل و پەلێن خۆراکی یێن هەیڤانە ب سەر وەلاتیێن هەرێما کوردستانێ دهێنە دابەشکرن ، وەزیرێ بازرگانی گووت : هەمان جۆرێ وی خۆراکی یە یێ ل سەرتاسەری عیراقێ دهێتە دابەشکرن	SCR-YEH,SCR-HEH,GRM-FNW
دەنگی خەلک 16-5-2022 –دەزگە هێ میدیایێ بادینان	دەنگی خەلک 16-5-2022 – دەزگەهێ میدیایێ بادینان	SPC-SPL,SPC-MRG
ل ناڤ هەلبژارتنێن ئێک ژ ئێکەتیێن یعراقی دا و ژ بەر هەبوونا کەسەکێ کورد د ناڤ لیژنا ئولومپی و ئەیدەوندیا وێ و فشارا وێ شیا کەسەکی ل سەر وێ ئێکەتیێ زێدەکەت	ل ناڤ هەلبژارتنێن ئێک ژ ئێکەتیێن عیراقی دا و ژ بەر هەبوونا کەسەکێ کورد د ناڤ لیژنا ئولومپی و ئەیدەوندیا وێ و فشارا وێ شیا کەسەکی ل سەر وێ ئێکەتیێ زێدەکەت	TYP-TRA
ددەمژمێرەکێدا نەە حالتین ژنبەردانێ دهێ نە تۆمارکرن – دەزگەهێ میدیایێ بادینان	د دەمژمێرەکێدا نەە حالتێن ژنبەردانێ دهێنە تۆمارکرن – دەزگەهێ میدیایێ بادینان	SCR-DIA,SPC-SPL,SPC-MRG
ئەڤجا ژبەر ئەڤا مە ئاماژە پێدای دیاردەیا ئاوارەبوونێ و ب تایبەتییا گەنجان بەرەڤ زێدەبونێ ڤە چوویە ئەوژی ژ ئەگەرێ نەبوونا دەلیڤەیێن کاری و هەروەسا هەر تشتەکێ گرێدای ب ژیانێ ڤە کو د شیێن بێژین وەک چاڤلێکرنەک ژی لێهاتیە	ئەڤجا ژبەر ئەڤا مە ئاماژە پێدای دیاردەیا ئاوارەبوونێ و ب تایبەتی یا گەنجان بەرەڤ زێدەبونێ ڤە چوویە ئەوژی ژ ئەگەرێ نەبوونا دەلیڤەیێن کاری و هەروەسا هەر تشتەکێ گرێدای ب ژیانێ ڤە کو د شیێن بێژین وەک چاڤلێکرنەک ژی لێهاتیە	SPC-MRG
بلند مەهدی، بۆ رۆژناما ئەڤرۆ گۆت: ئەز شیام رێزا ئێکێ ل سەر ئاستێ کوردستانێ و ئیراقێ دبۆارێ مۆزیکێ ب دەستڤەبینم کو ژەنینا مۆزیکا تاک ژەنی بوو، ئەز ئامێرێ قانونێ دژەنم، دو مامۆستایێن من پشتەڤانێن من بوونە هەتا گەهشتیمە ڤی ئاستی ئەوژی (بێکەس نوری عەبدال و بێوار محەمەد) بوون	بلند مەهدی، بۆ رۆژناما ئەڤرۆ گۆت: ئەز شیام رێزا ئێکێ ل سەر ئاستێ کوردستانێ و ئیراقێ دبۆارێ مۆزیکێ ب دەستڤەبینم کو ژەنینا مۆزیکا تاک ژەنی بوو، ئەز ئامێرێ قانونێ دژەنم، دو مامۆستایێن من پشتەڤانێن من بوونە هەتا گەهشتیمە ڤی ئاستی ئەو ژی (بێکەس نوری عەبدال و بێوار محەمەد) بوون	SPC-CLT
دەمێ خوە من گوتە سووریان: ” هوون وی دەمی دەست ب لڤین و چالاکییان دکەن کو دەلیڤا چ تشتەکی نەبیت”	دەمێ خوە من گۆتە سووریان: ” هوون وی دەمی دەست ب لڤین و چالاکییان دکەن کو دەلیڤا چ تشتەکی نەبیت”	SCR-DIA
لەور ب هزرەکا دی ڤێ بۆچوونێ رەت دکەت و دبێژیت: “دڤێت ئەوروپا دوماهیێ ب ڤێ هزرا داگیرکەر بینیت و هەولبدەت هێزەکا جیاواز، پرۆژەیەکێ جیاواز و خەیالەکا جساواز زێدە ئاراستەبکەت، هەروەسا جیهانا سیێ ببیتە شارستانیەتەکا نوی و ئالتەرناتیف بۆ سەقامگیریا رۆژئاڤا”	لەورا ب هزرەکا دی ڤێ بۆچوونێ رەت دکەت و دبێژیت: “دڤێت ئەوروپا دوماهیێ ب ڤێ هزرا داگیرکەر بینیت و هەولبدەت هێزەکا جیاواز، پرۆژەیەکێ جیاواز و خەیالەکا جیاواز زێدە ئاراستەبکەت، هەروەسا جیهانا سیێ ببیتە شارستانیەتەکا نوی و ئالتەرناتیف بۆ سەقامگیریا رۆژئاڤا”	TYP-DEL,TYP-SUB
ئینتیسار جەزائری، ئەنداما جڤاتا نوەنەرێن ئیراقێ ژ هەڤپەیمانیا چارچۆڤێ هەماهەنگیێ گۆت” شاندێ دانوستاندکارێ چرچۆڤێ هەماهەنگیێ سەرەدانا ئالیێن کوردی کریە کارێ خوە یێ بەراهیێ و ب کۆمبوونێ ل گەل ئێکەتی نیشتمانی کوردستان دەستپێکر کو ل رۆژا چارشەمبی 6 نیسانێ ل بەغدا هاتە ئەنجامدان”	ئینتیسار جەزائری، ئەنداما جڤاتا نوونەرێن ئیراقێ ژ هەڤپەیمانیا چارچۆڤێ هەماهەنگیێ گۆت” شاندێ دانوستاندکارێ چارچۆڤێ هەماهەنگیێ سەرەدانا ئالیێن کوردی کریە کارێ خوە یێ بەراهیێ و ب کۆمبوونێ ل گەل ئێکەتی نیشتمانی کوردستان دەستپێکر کو ل رۆژا چارشەمبی 6 نیسانێ ل بەغدا هاتە ئەنجامدان”	TYP-DEL,TYP-SUB
ب مێڤانراریا وەلیدئەحمهد، وەرگێڕ	ب مێڤانداریا وەلید ئەحمەد، وەرگێڕ	SPC-MRG,TYP-SUB,SCR-HEH
هەروەسا گۆت: ئەڤە بەرهەمێ منێ یێ چارێیە و مە ل بەرە ل دەستپێكا سالا نوو بهێتە بەلافکرن، هەکە زووتر ژی ب دووماهی هات دێ بەری سەرێ سالێ بەلاڤ کەین	هەروەسا گۆت: ئەڤە بەرهەمێ منێ یێ چارێ یە و مە ل بەرە ل دەستپێکا سالا نوو بهێتە بەلافکرن، هەکە زووتر ژی ب دووماهی هات دێ بەری سەرێ سالێ بەلاڤ کەین	SCR-KAF,SPC-CLT
ل گۆڕەی راپورتا سندوقا درافی، تیكرایا بهایێ بەرمیلەکا نەفتێ د ئەڤسالەدا ب 98 دولارا هاتبوو دیار کرن، دایە ئاماژە کرنژی بهایێ بەرمیلەکا نەفتێ بۆ سالا 2023ێ دێ کێم بین بۆ 85دولارو 5 سەنتە	ل گۆڕەی راپورتا سندوقا درافی، تیکرایا بهایێ بەرمیلەکا نەفتێ د ئەڤسالەدا ب 98 دولارا هاتبوو دیار کرن، دایە ئاماژە کرنژی بهایێ بەرمیلەکا نەفتێ بۆ سالا 2023ێ دێ کێم بین بۆ 85دولارو 5 سەنتا	TYP-SUB,SCR-KAF
خودان پێدڤیێن تایبەت پێدڤي ب رێزگرتنێنە نەکو دلپێڤەمانێ"	خودان پێدڤیێن تایبەت پێدڤی ب رێزگرتنێنە نەکو دلپێڤەمانێ"	SCR-YEH
دەقێ پەیاما نێچیرڤان بارزانی د ەلکەفتا ئەنفالێن بەهدینان دا:	دەقێ پەیاما نێچیرڤان بارزانی ب هەلکەفتا ئەنفالێن بەهدینان دا:	TYP-DEL,GRM-FNW
نەخۆشخانا هیوا: ئەگەر حکومەت پلانە کا موکم نەدانیت پێتڤیە تەڤایا بودجەیێ خۆ بو پەنجەشێرێ تەرخانبکەت	نەخۆشخانا هیوا: ئەگەر حکومەت پلانەکا موکم نەدانیت پێتڤیە تەڤایا بودجەیێ خۆ بو پەنجەشێرێ تەرخانبکەت	SPC-SPL
جوان عزەن/ پشکا پێنجێ	جوان عزەت/ پشکا پێنجێ	TYP-SUB
بۆ من ژی یا سەیر بوو، من گۆتێ سڤكایەتییا چ	بۆ من ژی یا سەیر بوو، من گۆتێ سڤکایەتییا چ	SCR-KAF
راهێنەرێ تیما باسکت بولا یانا زاخۆدیارکر وان رازیبونا رێکخستنا کەمپەکا راهێنانێ ژ کارگێریا یانێ وەرگرتیە، لێ هەتا پێشەکار ئامادە نەبن نەشێن ڤێ کەمپا راهێنانێ ب دانن	راهێنەرێ تیما باسکت بولا یانا زاخۆ دیارکر وان رازیبونا رێکخستنا کەمپەکا راهێنانێ ژ کارگێریا یانێ وەرگرتیە، لێ هەتا پێشەکار ئامادە نەبن نەشێن ڤێ کەمپا راهێنانێ ب دانن	SPC-MRG
بارزانیێ نەمر و چارەسهرکرنل ئاریشەیێن جڤاکی	بارزانیێ نەمر و چارەسەرکرنا ئاریشەیێن جڤاکی	SCR-HEH,TYP-SUB
هەر ئەڤرۆ نێچیرڤان بارزانی دێ ل گەل عەمار حەكیم، سەرۆکێ رەوتا حیکمە، عادل عەبدولمەهدی، سەرۆکوەزیرێن پێشتر یێن ئیراقێ، ئەبو کەرار، سەرۆکێ مەکتەبا سیاسی یا نەهجا نشتیمانی و رەوتا سەدری کۆمبیت	هەر ئەڤرۆ نێچیرڤان بارزانی دێ ل گەل عەمار حەکیم، سەرۆکێ رەوتا حیکمە، عادل عەبدولمەهدی، سەرۆکوەزیرێن پێشتر یێن ئیراقێ، ئەبو کەرار، سەرۆکێ مەکتەبا سیاسی یا نەهجا نشتیمانی و رەوتا سەدری کۆمبیت	SCR-KAF
سەرەکی گۆتار بەر ب کنگرەیێ چاردێ	سەرەکی گۆتار بەر ب کۆنگرەیێ چاردێ	TYP-DEL
سەرەکی/گرنگ بوسلایدی/ژێدەرەک: ژ کۆما 25 وەزارەتان 13 بۆ شیعەیانە	سەرەکی/گرنگ بو سلایدی/ژێدەرەک: ژ کۆما 25 وەزارەتان 13 بۆ شیعەیانە	SPC-MRG
02 ملیۆن کەسان گیانێ خۆ زدەستژاینە”	02 ملیۆن کەسان گیانێ خۆ ژدەستداینە”	TYP-SUB,TYP-SUB
بێی ئاگەهداریا حکومەتا هەر ێمێ بەغدا د بزاڤا کڕینا 300 هزار تەنێن گەنمی دایە	بێی ئاگەهداریا حکومەتا هەرێمێ بەغدا د بزاڤا کڕینا 300 هزار تەنێن گەنمی دایە	SPC-SPL
ناشرینترین دەموچاوەکانی، ناجۆرترین دیمەنەکانی سیاسەتکردن ناونیشانی رەوتی کارکردنی ئەو حزبەیە لەناو واقعی سیاسی کەرکوک و لەناو واقعی سیاسەتی کوردستانیشدا، وەختێک باسەکەیان دێتەسەر کەرکوک	ناشرینترین دەموچاوەکانی، ناجۆرترین دیمەنەکانی سیاسەتکردن ناونیشانی رەوتی کارکردنی ئەو حزبەیە لەناو واقعی سیاسی کەرکوک و لەناو واقعی سیاسەتی کوردستانیشدا، وەختێک باسەکەیان دێتە سەر کەرکوک	SPC-MRG
هەمهرەنگ 25/09/2014 09:28 3021	هەمەرەنگ 25/09/2014 09:28 3021	SCR-HEH
د گەرا پێنچێ ل قوناغا کومێن خولا یانەیێن قارەمانێن ئەوروپا سوباهی لدەمژمێر 7:45 چێلسی یا ئنگلیزی ژدەرڤەی یاریگەها خو دێ بەرامبەر رێدبول سالزبورگ یا نەمساوی یاریێ کەت و سیڤیا یا ئسپانی دێ مێهڤانداریا کوبنهاگن یا دانیمارکی کەت	د گەرا پێنچێ ژ قوناغا کومێن خولا یانەیێن قارەمانێن ئەوروپا سوباهی لدەمژمێر 7:45 چێلسی یا ئنگلیزی ژدەرڤەی یاریگەها خو دێ بەرامبەر رێدبول سالزبورگ یا نەمساوی یاریێ کەت و سیڤیا یا ئسپانی دێ مێهڤانداریا کوبنهاگن یا دانیمارکی کەت	GRM-FNW
کۆچا لمیۆنی و چوارەنڤێسەکێ نەدیار	کۆچا ملیۆنی و چوارەنڤێسەکێ نەدیار	TYP-TRA
بڤی ئەنجامی ئەرسنال ب کوکرنا 28 خالا ل پێشەنگیا رێزبەندیا ئینگلتەرا ما و فولهام ژی ل رێزا 7 ما و ئەستون ڤیلان و ساوسهامپتون و لی ستەر ستی لرێزا 14,15,16ی دانە	بڤی ئەنجامی ئەرسنال ب کوکرنا 28 خالا ل پێشەنگیا رێزبەندیا ئینگلتەرا ما و فولهام ژی ل رێزا 7 ما و ئەستون ڤیلان و ساوسهامپتون و لیستەر ستی لرێزا 14,15,16ێ دانە	SPC-SPL,SCR-DIA
دهۆک، رەڤین سالح کاوەند:	دهۆک، رەڤین سالح لاوەند:	TYP-SUB
ئاسایشا سلێمانیی: دوو تیرۆدیست هاتنە کۆشتن	ئاسایشا سلێمانیێ: دوو تیرۆریست هاتنە کۆشتن	SCR-DIA,TYP-SUB
بەرنامێ : گوند و ژیان گوندێ :شیڤ رە زی ئامادەکرن و پێشکێشکرن : مێ ڤان بەرواری	بەرنامێ : گوند و ژیان گوندێ :شیڤ رەزای ئامادەکرن و پێشکێشکرن : مێڤان بەرواری	SPC-SPL,TYP-DEL,SPC-SPL
جڤاتا نوونەرێن ئیراقێ کارامەیا کۆمبوونا ئەڤرۆ سێشەمبی 22-11-2022 بەلاڤکرو دیار کر کو یا تایبەتە ب باسکرنا پێشێلکرنا سەروەریا ئاخا ئیراقێ، ئەڤە د دەمەکی دایە کو فراکسیۆنێن کوردستانی ل جڤاتا نوونەرێن ئیراقێ هێرشێن ئیرانێ و تورکیا شەرمزارکرن و داخواز ژ جڤاکێ نێڤدەولەتی کر سیستەمێ بەرگریا ئەسمانی ڕادەستی ئیراقێ بکەت بۆ ڕیگریکرنێ ل وان هێرشان	جڤاتا نوونەرێن ئیراقێ کارنامەیا کۆمبوونا ئەڤرۆ سێشەمبی 22-11-2022 بەلاڤکرو دیارکر کو یا تایبەتە ب باسکرنا پێشێلکرنا سەروەریا ئاخا ئیراقێ، ئەڤە د دەمەکی دایە کو فراکسیۆنێن کوردستانی ل جڤاتا نوونەرێن ئیراقێ هێرشێن ئیرانێ و تورکیا شەرمزارکرن و داخواز ژ جڤاکێ نێڤدەولەتی کر سیستەمێ بەرگریا ئەسمانی ڕادەستی ئیراقێ بکەت بۆ ڕیگریکرنێ ل وان هێرشان	SPC-SPL,TYP-DEL
دەڤەردارێ سێمیلێ دیار کر، ل دەڤەرا کواشێ یا سەر ب دەڤەرداریا سێمێلێڤە هندەک پارزینگەهێن نەیاسایی هاتبوونە دانان و دبێژیت: نوکە بڕیار هاتیەان ئەو هەموو پارزینگەهە بهێنە ژناڤبرن و ل دەستپێکێ ژی 26 پارزینگەهێن نەیاسایی هاتنە ژناڤبرن	دەڤەردارێ سێمیلێ دیار کر، ل دەڤەرا کواشێ یا سەر ب دەڤەرداریا سێمێلێ ڤە هندەک پارزینگەهێن نەیاسایی هاتبوونە دانان و دبێژیت: نوکە بڕیار هاتیەدان ئەو هەموو پارزینگەهە بهێنە ژناڤبرن و ل دەستپێکێ ژی 26 پارزینگەهێن نەیاسایی هاتنە ژناڤبرن	TYP-DEL,SPC-CLT
پێلەکابارانی دێ ب سەر ئیراقێ دا هێت	پێلەکا بارانێ دێ ب سەر ئیراقێ دا هێت	SPC-MRG,SCR-DIA
دەمژمێرێن دەستپێکێ ل سپێدێ، گەلەک د نخۆشنبو هندەک جورێن نەخۆشان، چونکو گوهۆرینێن فزیولوژی دناڤ لەشی دا ل وی دەمێ رۆژێ، دبنە ئەگەرێ دژواربوونا نیشانان بو هندەک نەخۆشیان، ل ڤێرێ دێ هندەک نەخۆشیان دەینە دیارکرن ئەوێن ل سپێدەهیان نیشانێن وان دژوار دبن ل دووڤ سایتێ Webed	دەمژمێرێن دەستپێکێ ل سپێدێ، گەلەک د نەخۆشن بو هندەک جورێن نەخۆشان، چونکو گوهۆرینێن فزیولوژی دناڤ لەشی دا ل وی دەمێ رۆژێ، دبنە ئەگەرێ دژواربوونا نیشانان بو هندەک نەخۆشیان، ل ڤێرێ دێ هندەک نەخۆشیان دەینە دیارکرن ئەوێن ل سپێدەهیان نیشانێن وان دژوار دبن ل دووڤ سایتێ Webmed	TYP-DEL,TYP-DEL,SPC-MRG
جمبد شوکری گۆتژی: خەلک د ناڤا (168)قوتابخانا دابوویه، زاخۆ (136) قوتابخانە، سێمێلێ (97)، قوتابخانە و بەردەرەش (29) قوتابخانابووینە…	جمبد شوکری گۆتژی: خەلک د ناڤا (168)قوتابخانا دابوویە، زاخۆ (136) قوتابخانە، سێمێلێ (97)، قوتابخانە و بەردەرەش (29) قوتابخانابووینە…	SCR-HEH
سەرەکی ڤیدیۆ ئەنجوومەنێ ئاسایشێ دانپێدانا گرۆپەکێ تیرورستی بەلاڤ دکات	سەرەکی ڤیدیۆ ئەنجوومەنێ ئاسایشێ دانپێدانا گرۆپەکێ تیرورستی بەلاڤ دکەت	TYP-SUB
فێجا بەرپەرێن رۆژنامان و دیدارێن تەلەفزیۆنی و رادیۆیا د هەڤڕکیێ دا کلیپێ بەهرا خوە یا هێرەشکرنێ هەبوو، مینا: شعر نابیت کلیپ، شعر ب خوە وێنەیە چاوا دێ هیتە وێنەکرن، ئێکی د بەرسڤا پرسیارەکێ دا دلێ خوە خرابکر ژ کەنی و گۆت: مامۆ شعر ئەدەبە و کلیپ هونەرە ژ ئەرد و ئاسمانان ژێکجودانە	ڤێجا بەرپەرێن رۆژنامان و دیدارێن تەلەفزیۆنی و رادیۆیا د هەڤڕکیێ دا کلیپێ بەهرا خوە یا هێرەشکرنێ هەبوو، مینا: شعر نابیت کلیپ، شعر ب خوە وێنەیە چاوا دێ هیتە وێنەکرن، ئێکی د بەرسڤا پرسیارەکێ دا دلێ خوە خرابکر ژ کەنی و گۆت: مامۆ شعر ئەدەبە و کلیپ هونەرە ژ ئەرد و ئاسمانان ژێکجودانە	SCR-DIA
سەرهکی/ساخلەمی/هژمارا حالەتێن تەوشبوونێ ب خوریکا مەیموونان هاتە ئەشکەرا کرن	سەرەکی/ساخلەمی/هژمارا حالەتێن تووشبوونێ ب خوریکا مەیموونان هاتە ئەشکەرا کرن	TYP-SUB,SCR-HEH
سەرەکی عیراق شاخەوان عەبدوللا: پاتی دێ هەموو بزاڤان کەت بۆ گوهۆرينا پارێزگەرێ سەپاندیێ کەرکووکێ	سەرەکی عیراق شاخەوان عەبدوللا: پارتی دێ هەموو بزاڤان کەت بۆ گوهۆرینا پارێزگەرێ سەپاندیێ کەرکووکێ	TYP-DEL,SCR-YEH
سەرەکی کوردستان بابەکر زێباری: ئیران و تو رکیا ب دلمرادی سنوورێن خوە کۆنترۆل ناکەن	سەرەکی کوردستان بابەکر زێباری: ئیران و تورکیا ب دلمرادی سنوورێن خوە کۆنترۆل ناکەن	SPC-SPL
هەروەسا گۆتژی: دڤێت کارەبێ بۆ رۆناهیێبکاربینن نە بۆ گەرمێ، داکو کارتێکرنێ ل سەر تۆڕێن کارەبێ نەکەت	هەروەسا گۆتژی: دڤێت کارەبێ بۆ رۆناهیێ بکاربینن نە بۆ گەرمێ، داکو کارتێکرنێ ل سەر تۆڕێن کارەبێ نەکەت	SPC-MRG
